{
  "schemaVersion": "1.0",
  "id": "rcpt_01",
  "projectId": "p1",
  "jobId": "job_01",
  "provider": "example_asr",
  "dataType": "transcript",
  "purpose": "Director plan proposal",
  "sentAt": "2026-10-05T12:00:00Z",
  "bytes": 2048,
  "estimatedCostUsd": 0.01,
  "retentionPolicyUrl": "https://example.com/retention"
}
